id,title,thumbnail,description,title
nevMXFkTQvY,Talkboctopus Seminar Series - Season 1 Episode 4 - Casey Fiesler,https://i.ytimg.com/vi/nevMXFkTQvY/sddefault.jpg,"Casey Fiesler: Assistant Professor at CU Boulder with appointments in Information Science and Computer Science; affiliations with Silicon Flatirons and the ATLAS institute; specializing in data ethics, law and policy, online communities

Talk Title: Data Is People: Ethics and Education for Data Science

Talk Abstract: Big data has opened up new possibilities and transformed the ways we conduct research in nearly every discipline. However, ethical considerations and education for research has long focused on human subjects, governed in the U.S. by institutional review boards. Data science often falls through the cracks of these regulations, so it is even more imperative that we have strong ethical norms and guidelines. This starts with the reminder that though data scientists may not interact directly with people, the data collected and analyzed very often comes from people, which opens up important considerations around privacy, consent, and harm. Moreover, applications of data science research, particularly with respect to prediction, have the potential for large-scale societal impacts. In considering the broad landscape of technology ethics when it comes to uses and applications of big data, I will argue for a fundamental shift in how we teach ethics to future data scientists and researchers.

Speaker Bio: Dr. Casey Fiesler is an assistant professor and founding faculty in the Department of Information Science as well as Computer Science, by courtesy, at University of Colorado Boulder, where she researches and teaches in the areas of technology ethics, internet law and policy, and online communities. Also a public scholar, she is a frequent commentator and speaker on topics of technology ethics and policy, as well as women in STEM (including consulting with Mattel on their computing-related Barbies). Her work on research ethics for data science, ethics education in computing, and broadening participation in computing is supported by the National Science Foundation, as well as Mozilla and Omidyar Network as part of the Responsible Computer Science Challenge.",Talkboctopus Seminar Series - Season 1 Episode 4 - Casey Fiesler
O9Bzdwziziw,Talkboctopus Seminar Series - S1 E3 - Elisa Omodei,https://i.ytimg.com/vi/O9Bzdwziziw/sddefault.jpg,"Elisa Omodei, Predictive Analytics Lead, mobile Vulnerability Analysis and Monitoring at the UN World Food Programme, Vice-President Secretary, The Complex Systems Society

Talk Title:
Who, where, why: non-traditional data and predictive analytics to map socio-economic vulnerabilities

Talk Abstract:
In a rapidly changing world, severely affected by extreme weather events, epidemic outbreaks, economic shocks and conflicts, it is of fundamental importance to understand where the most vulnerable people are, how many they are, and to identify what it is that makes them more vulnerable than others to these threats. During the last decade, research has shown that data such as digital traces, phone metadata and satellite imagery carry relevant information beyond their original purpose and can be used as a proxy to measure socio-economic characteristics and detect vulnerabilities when traditional data is not available. Following an overview of these studies, the talk will deep dive into the UN World Food Programme’s original work on predicting food security. We will then conclude by discussing challenges and limitations, but also opportunities, that come with these approaches.

Speaker Bio:
Elisa Omodei is the Predictive Analytics Lead of the Hunger Monitoring Unit at the World Food Programme’s Research, Assessment and Monitoring division. She also serves as Vice-President Secretary of the Complex Systems Society. She holds a BSc and a MSc in Physics and a PhD in Applied Mathematics for the Social Sciences. After her PhD, she spent a few years in academia before joining the United Nations in 2017, first at UNICEF's Office of Innovation and now at the World Food Programme.",Talkboctopus Seminar Series - S1 E3 - Elisa Omodei
XEOynWjVP2o,Talkboctopus Seminar Series -  S1 E2  -  DJ Patil,https://i.ytimg.com/vi/XEOynWjVP2o/hqdefault.jpg,"Season 1 Episode 2 - August 31, 2020  
Speaker: DJ Patil 

DJ Patil has held a variety of roles in Academia, Industry, and Government.
He is Head of Technology for Devoted Health, a Senior Fellow at the Belfer Center at the Harvard Kennedy School, and an Advisor to Venrock Partners.

Dr. Patil was appointed by President Obama to be the first U.S. Chief Data Scientist where his efforts led to the establishment of nearly 40 Chief Data Officer roles across the Federal government. He also established new health care programs including the Precision Medicine Initiative and the Cancer Moonshot, new criminal justice reforms including the Data-Driven Justice and Police Data Initiatives that cover more than 94 million Americans, as well as leading the national data efforts. He also has been active in national security and for his efforts was awarded by Secretary Carter the Department of Defense Medal for Distinguished Public Service which the highest honor the department bestows on a civilian.

In industry, he led the product teams at RelateIQ which was acquired by Salesforce, was founding board member for Crisis Text Line which works to use new technologies to provide on demand mental and crisis support, and was a member of the venture firm Greylock Partners. He has also was Chief Scientist, Chief Security Officer and Head of Analytics and Data Product Teams at the LinkedIn Corporation where he co-coined the term Data Scientist. He has also held a number of roles at Skype, PayPal, and eBay.

As a member of the faculty at the University of Maryland, his research focused on nonlinear dynamics and chaos theory and he helped start a major research initiative on numerical weather prediction. As an AAAS Science & Technology Policy Fellow for the Department of Defense, Dr. Patil directed new efforts to leverage social network analysis and the melding of computational and social sciences to anticipate emerging threats to the US. He has also co-chaired a major review of US efforts to prevent bioweapons proliferation in Central Asia and co-founded the Iraqi Virtual Science Library (IVSL). In 2104 he was selected by the World Economic Forum as a Young Global Leader and is also a Member of the Council of Foreign Relations.

More details can be found on his LinkedIn profile: http://www.linkedin.com/in/dpatil and can be followed on twitter @dpatil",Talkboctopus Seminar Series -  S1 E2  -  DJ Patil
eOkuGc8S_R8,"“Maps: Lost Between Objectivity and Propaganda” -- Nicholas Danforth, June 17, 2020",https://i.ytimg.com/vi_webp/eOkuGc8S_R8/maxresdefault.webp,"Abstract: Mapmakers, like historians, face a tension in their work between the ideal of objectivity and the recognition that their work will inevitably be political. Even when factually accurate, maps, like history, are shaped by their perspective, as well as countless decisions about what to include and what to leave out. This means that all maps will be biased. But it also means that simply pointing out this bias is only the first step toward trying to understand how and why they were created. In this talk, I draw on my experience with history, and the politics which surround the writing of it, to look at how maps can be used to understand the worldviews of the people who created them.

Speaker: Nicholas Danforth most recently worked as a fellow with the Bipartisan Policy Center (BPC) national security program. Prior to joining BPC in January 2016, he worked on Middle East policy issues for Concepts and Strategies and the International Center for Religion and Diplomacy. Danforth received his M.A. from the School of Oriental and African Studies and his B.A. from Yale. He completed his Ph.D. in history at Georgetown University in 2015 and has written widely about Turkey, U.S. foreign policy, and the Middle East for publications including The Atlantic, The Washington Post, Foreign Policy, Al Jazeera, and Foreign Affairs.

http://www.midafternoonmap.com/

https://twitter.com/NicholasDanfort","“Maps: Lost Between Objectivity and Propaganda” -- Nicholas Danforth, June 17, 2020"
Ci2PvErQGyk,Talkboctopus Seminar Series -  S1 E1  -  Josh Weitz,https://i.ytimg.com/vi/Ci2PvErQGyk/maxresdefault.jpg,"Season 1 Episode 1 - June 10, 2020  
Speaker: Joshua Weitz
Talk Title: Modeling Shield Immunity — From Concept to Implementation

Abstract: Developing intervention strategies that can reduce transmission and alleviate the impacts of social distancing is an essential goal of long-term public health responses to the ongoing COVID-19 pandemic. In this talk I will describe our efforts to develop models of ‘shield immunity’, i.e., leveraging serological testing and the increased interaction rates of recovered individuals to reduce new chains of transmission and foster safer economic re-engagement. I will then discuss initial steps to translate these principles into actions, including connecting serological test analytics and developing feasibility models for implementation in pilot settings.

Affiliation: School of Biological Sciences, Georgia Institute of Technology; School of Physics, Georgia Institute of Technology
Program in Quantitative Biosciences, Georgia Institute of Technology; Associate Editor, Journal of Theoretical Biology
Senior Editor, ISME J",Talkboctopus Seminar Series -  S1 E1  -  Josh Weitz
